{
  "schema": "ausmalwiese.cut-paste.character.v1",
  "slug": "halloween-fledermaus",
  "season": "Halloween",
  "age_range": "3-6",
  "preview_source": "recompose-exact-parts",
  "print_target": {
    "paper": "A4",
    "orientation": "portrait",
    "raster_px": [
      2480,
      3508
    ],
    "dpi": 300,
    "color_mode": "RGB"
  },
  "page_layout": {
    "ink_box_mm": [
      17,
      17,
      193,
      256
    ],
    "assembled_origin_mm": [
      0,
      0
    ],
    "preview_box_mm": [
      160,
      18,
      30,
      28
    ]
  },
  "cut_style": {
    "color": "#000000",
    "stroke_width_mm": 0.6,
    "dash_mm": 2.5,
    "gap_mm": 2.5
  },
  "parts": [
    {
      "id": "body",
      "feature": "body",
      "role": "base",
      "art": {
        "size_mm": [
          76,
          100
        ],
        "outer_path_d": "M 38 0 C 68 0 76 22 76 54 C 76 83 58 100 38 100 C 18 100 0 83 0 54 C 0 22 8 0 38 0 Z",
        "fill": "#7451B6",
        "stroke": "#171328",
        "stroke_width_mm": 1,
        "interior": [
          {
            "path_d": "M 38 33 C 58 33 64 48 64 70 C 64 89 53 94 38 94 C 23 94 12 89 12 70 C 12 48 18 33 38 33 Z",
            "fill": "#CDB3EC"
          }
        ]
      },
      "cut": {
        "method": "offset-of-outer-path",
        "offset_mm": 2
      },
      "assembly": {
        "translate_mm": [
          67,
          99
        ],
        "rotate_deg": 0,
        "scale": 1,
        "z_index": 0
      },
      "glue": null,
      "built_in_features": [
        "belly"
      ]
    },
    {
      "id": "ear-left",
      "feature": "ear-left",
      "role": "cutout",
      "art": {
        "size_mm": [
          25,
          36
        ],
        "outer_path_d": "M 0 36 L 13 0 L 25 36 Z",
        "fill": "#7451B6",
        "stroke": "#171328",
        "stroke_width_mm": 1,
        "interior": []
      },
      "cut": {
        "method": "offset-of-outer-path",
        "offset_mm": 2
      },
      "assembly": {
        "translate_mm": [
          75,
          71
        ],
        "rotate_deg": 0,
        "scale": 1,
        "z_index": 1
      },
      "glue": {
        "target_id": "body",
        "side": "front",
        "piece_anchor_mm": [
          13,
          32
        ],
        "target_anchor_mm": [
          21,
          4
        ],
        "minimum_contact_area_mm2": 15,
        "sequence": 1
      }
    },
    {
      "id": "ear-right",
      "feature": "ear-right",
      "role": "cutout",
      "art": {
        "size_mm": [
          25,
          36
        ],
        "outer_path_d": "M 0 36 L 12 0 L 25 36 Z",
        "fill": "#7451B6",
        "stroke": "#171328",
        "stroke_width_mm": 1,
        "interior": []
      },
      "cut": {
        "method": "offset-of-outer-path",
        "offset_mm": 2
      },
      "assembly": {
        "translate_mm": [
          112,
          71
        ],
        "rotate_deg": 0,
        "scale": 1,
        "z_index": 2
      },
      "glue": {
        "target_id": "body",
        "side": "front",
        "piece_anchor_mm": [
          12,
          32
        ],
        "target_anchor_mm": [
          57,
          4
        ],
        "minimum_contact_area_mm2": 15,
        "sequence": 2
      }
    },
    {
      "id": "wing-left",
      "feature": "wing-left",
      "role": "cutout",
      "art": {
        "size_mm": [
          48,
          50
        ],
        "outer_path_d": "M 48 6 C 22 0 17 14 0 6 L 5 50 L 24 39 L 40 49 Z",
        "fill": "#7451B6",
        "stroke": "#171328",
        "stroke_width_mm": 1,
        "interior": []
      },
      "cut": {
        "method": "offset-of-outer-path",
        "offset_mm": 2
      },
      "assembly": {
        "translate_mm": [
          28,
          124
        ],
        "rotate_deg": 0,
        "scale": 1,
        "z_index": 3
      },
      "glue": {
        "target_id": "body",
        "side": "front",
        "piece_anchor_mm": [
          44,
          28
        ],
        "target_anchor_mm": [
          5,
          53
        ],
        "minimum_contact_area_mm2": 15,
        "sequence": 3
      }
    },
    {
      "id": "wing-right",
      "feature": "wing-right",
      "role": "cutout",
      "art": {
        "size_mm": [
          48,
          50
        ],
        "outer_path_d": "M 0 6 C 26 0 31 14 48 6 L 43 50 L 24 39 L 8 49 Z",
        "fill": "#7451B6",
        "stroke": "#171328",
        "stroke_width_mm": 1,
        "interior": []
      },
      "cut": {
        "method": "offset-of-outer-path",
        "offset_mm": 2
      },
      "assembly": {
        "translate_mm": [
          134,
          124
        ],
        "rotate_deg": 0,
        "scale": 1,
        "z_index": 4
      },
      "glue": {
        "target_id": "body",
        "side": "front",
        "piece_anchor_mm": [
          4,
          28
        ],
        "target_anchor_mm": [
          71,
          53
        ],
        "minimum_contact_area_mm2": 15,
        "sequence": 4
      }
    },
    {
      "id": "eye-left",
      "feature": "eye-left",
      "role": "cutout",
      "art": {
        "size_mm": [
          20,
          22
        ],
        "outer_path_d": "M 10 0 C 22 0 23 22 10 22 C -3 22 -2 0 10 0 Z",
        "fill": "#F7CD66",
        "stroke": "#171328",
        "stroke_width_mm": 1,
        "interior": [
          {
            "path_d": "M 10 6 C 15 6 15 16 10 16 C 5 16 5 6 10 6 Z",
            "fill": "#171328"
          }
        ]
      },
      "cut": {
        "method": "offset-of-outer-path",
        "offset_mm": 2
      },
      "assembly": {
        "translate_mm": [
          79,
          118
        ],
        "rotate_deg": 0,
        "scale": 1,
        "z_index": 5
      },
      "glue": {
        "target_id": "body",
        "side": "front",
        "piece_anchor_mm": [
          10,
          10
        ],
        "target_anchor_mm": [
          22,
          29
        ],
        "minimum_contact_area_mm2": 15,
        "sequence": 5
      }
    },
    {
      "id": "eye-right",
      "feature": "eye-right",
      "role": "cutout",
      "art": {
        "size_mm": [
          20,
          22
        ],
        "outer_path_d": "M 10 0 C 22 0 23 22 10 22 C -3 22 -2 0 10 0 Z",
        "fill": "#F7CD66",
        "stroke": "#171328",
        "stroke_width_mm": 1,
        "interior": [
          {
            "path_d": "M 10 6 C 15 6 15 16 10 16 C 5 16 5 6 10 6 Z",
            "fill": "#171328"
          }
        ]
      },
      "cut": {
        "method": "offset-of-outer-path",
        "offset_mm": 2
      },
      "assembly": {
        "translate_mm": [
          112,
          118
        ],
        "rotate_deg": 0,
        "scale": 1,
        "z_index": 6
      },
      "glue": {
        "target_id": "body",
        "side": "front",
        "piece_anchor_mm": [
          10,
          10
        ],
        "target_anchor_mm": [
          55,
          29
        ],
        "minimum_contact_area_mm2": 15,
        "sequence": 6
      }
    },
    {
      "id": "smile",
      "feature": "mouth",
      "role": "cutout",
      "art": {
        "size_mm": [
          29,
          15
        ],
        "outer_path_d": "M 0 0 Q 14 15 29 0 Q 16 20 0 0 Z",
        "fill": "#FFFFFF",
        "stroke": "#171328",
        "stroke_width_mm": 1,
        "interior": []
      },
      "cut": {
        "method": "offset-of-outer-path",
        "offset_mm": 2
      },
      "assembly": {
        "translate_mm": [
          91,
          146
        ],
        "rotate_deg": 0,
        "scale": 1,
        "z_index": 7
      },
      "glue": {
        "target_id": "body",
        "side": "front",
        "piece_anchor_mm": [
          14,
          9
        ],
        "target_anchor_mm": [
          38,
          56
        ],
        "minimum_contact_area_mm2": 15,
        "sequence": 7
      }
    },
    {
      "id": "hat",
      "feature": "hat",
      "role": "cutout",
      "art": {
        "size_mm": [
          97,
          49
        ],
        "outer_path_d": "M 10 43 L 34 43 L 56 0 L 73 43 L 87 43 L 97 49 L 0 49 Z",
        "fill": "#4A2A7E",
        "stroke": "#171328",
        "stroke_width_mm": 1,
        "interior": [
          {
            "path_d": "M 29 37 L 78 37 L 81 43 L 26 43 Z",
            "fill": "#F3A45E"
          }
        ]
      },
      "cut": {
        "method": "offset-of-outer-path",
        "offset_mm": 2
      },
      "assembly": {
        "translate_mm": [
          56,
          56
        ],
        "rotate_deg": 0,
        "scale": 1,
        "z_index": 8
      },
      "glue": {
        "target_id": "body",
        "side": "front",
        "piece_anchor_mm": [
          49,
          45
        ],
        "target_anchor_mm": [
          38,
          2
        ],
        "minimum_contact_area_mm2": 15,
        "sequence": 8
      }
    }
  ]
}
